{
  "@context": [
    "https://www.w3.org/ns/credentials/v2",
    "https://vc4qi.example/contexts/rm/1"
  ],
  "id": "https://lab.vc4qi.example/credentials/S",
  "type": [
    "VerifiableCredential",
    "RmStudy"
  ],
  "issuer": "https://lab.vc4qi.example/controller",
  "validFrom": "2026-01-15T00:00:00Z",
  "validUntil": "2031-01-15T00:00:00Z",
  "credentialSchema": {
    "id": "https://vc4qi.example/schemas/rm/1/study.json",
    "type": "JsonSchema"
  },
  "credentialSubject": {
    "id": "urn:vc4qi-example:batch:cuzn39pb3-disc-lot-1",
    "activityTime": "2026-01-10T00:00:00Z",
    "studyTypeIri": "https://vc4qi.example/bindings/rm/1#Homogeneity",
    "propertyIri": "https://vc4qi.example/bindings/rm/1#As",
    "matrixIri": "https://vc4qi.example/bindings/rm/1#CuZn39Pb3",
    "outcomeIri": "https://vc4qi.example/bindings/rm/1#Homogeneous"
  },
  "termsOfUse": [
    {
      "type": "RmAuthorizationPolicy",
      "authorizationCredential": {
        "id": "https://nab.vc4qi.example/credentials/H",
        "type": "RmLabAuthority"
      }
    }
  ],
  "relatedResource": [
    {
      "id": "https://nab.vc4qi.example/credentials/H",
      "digestSRI": "sha384-sE3NHMOoUdyLD5zsaeeXlmHRDMdJhYR6gC8gZUtlRcXW5ny6bjaDoi5rLX54/pWt"
    }
  ],
  "credentialStatus": {
    "id": "https://lab.vc4qi.example/status/1#0",
    "type": "BitstringStatusListEntry",
    "statusPurpose": "revocation",
    "statusListIndex": "0",
    "statusListCredential": "https://lab.vc4qi.example/status/1"
  },
  "proof": {
    "type": "DataIntegrityProof",
    "cryptosuite": "eddsa-rdfc-2022",
    "proofPurpose": "assertionMethod",
    "verificationMethod": "https://lab.vc4qi.example/controller#key-1",
    "created": "2026-01-15T00:00:00Z",
    "proofValue": "z3MQH4Luf7NvA16RoUTjHwARjrYNmUtCX7ELjwZACitu4c5CJzrB8deuXe62HXRPWqssSUtZZaogC6Y9anfPtVXaA"
  }
}
